{
  "schema_version": "1.0.0",
  "graph_version": "0.0.0",
  "project": {
    "id": "ombra_del_vesper",
    "title": "L'Ombra del Vesper",
    "subtitle": "Dark romance — Dante Ravencroft & Aurora Winters",
    "medium": "testo",
    "target_audience": "donne 35-50, Kindle Unlimited",
    "language": "it",
    "created_at": "2026-06-05",
    "updated_at": "2026-06-05"
  },
  "entities": {
    "characters": {
      "dante_ravencroft": {
        "id": "dante_ravencroft",
        "name": "Dante Ravencroft",
        "aliases": [
          "Dante",
          "il Cacciatore",
          "il proprietario"
        ],
        "category": "protagonisti",
        "type": "protagonista_maschile",
        "role_saga": "proprietario del Vesper, antagonista/love interest",
        "appears_in_units": [],
        "stato_per_unita": {},
        "links": {
          "catalog_path": "catalogo/characters/dante_ravencroft/scheda.md",
          "bibbia_section": "personaggi/dante"
        },
        "promotion": {
          "promoted_at": "2026-06-05",
          "promoted_by": "bootstrap",
          "promotion_unit": null
        },
        "voice": {
          "register": "linguaggio del controllo",
          "verbi_dominanti": [
            "possedere",
            "cacciare",
            "controllare",
            "decidere",
            "proteggere"
          ]
        }
      },
      "rory_winters": {
        "id": "rory_winters",
        "name": "Aurora 'Rory' Winters",
        "aliases": [
          "Rory",
          "Aurora",
          "la giornalista"
        ],
        "category": "protagonisti",
        "type": "protagonista_femminile",
        "role_saga": "giornalista investigativa, POV principale",
        "appears_in_units": [],
        "stato_per_unita": {},
        "links": {
          "catalog_path": "catalogo/characters/rory_winters/scheda.md",
          "bibbia_section": "personaggi/rory"
        },
        "promotion": {
          "promoted_at": "2026-06-05",
          "promoted_by": "bootstrap",
          "promotion_unit": null
        },
        "voice": {
          "register": "linguaggio della resistenza",
          "verbi_dominanti": [
            "scavare",
            "scoprire",
            "combattere",
            "resistere",
            "investigare"
          ]
        }
      },
      "natasha_volkov": {
        "id": "natasha_volkov",
        "name": "Natasha Volkov",
        "aliases": [
          "Natasha"
        ],
        "category": "secondari",
        "type": "personaggio_secondario",
        "role_saga": "habitué del Vesper, possibile complice o vittima",
        "appears_in_units": [],
        "stato_per_unita": {},
        "links": {
          "catalog_path": "catalogo/characters/natasha_volkov/scheda.md",
          "bibbia_section": "personaggi/natasha"
        },
        "promotion": {
          "promoted_at": "2026-06-05",
          "promoted_by": "bootstrap",
          "promotion_unit": null
        }
      },
      "adrian": {
        "id": "adrian",
        "name": "Adrian",
        "aliases": [
          "Adrian"
        ],
        "category": "antagonisti",
        "type": "antagonista",
        "role_saga": "antagonista, collegamento alle ragazze scomparse",
        "appears_in_units": [],
        "stato_per_unita": {},
        "links": {
          "catalog_path": "catalogo/characters/adrian/scheda.md",
          "bibbia_section": "personaggi/adrian"
        },
        "promotion": {
          "promoted_at": "2026-06-05",
          "promoted_by": "bootstrap",
          "promotion_unit": null
        }
      },
      "sofia_volkov": {
        "id": "sofia_volkov",
        "name": "Sofia Volkov",
        "aliases": [
          "Sofia"
        ],
        "category": "secondari",
        "type": "personaggio_secondario",
        "role_saga": "figlia/sorella dei Volkov, detenuta nel Level -2",
        "appears_in_units": [],
        "stato_per_unita": {},
        "links": {
          "catalog_path": "catalogo/characters/sofia_volkov/scheda.md",
          "bibbia_section": "personaggi/sofia"
        },
        "promotion": {
          "promoted_at": "2026-06-05",
          "promoted_by": "bootstrap",
          "promotion_unit": null
        }
      }
    },
    "locations": {
      "the_vesper": {
        "id": "the_vesper",
        "name": "The Vesper",
        "aliases": [
          "il Vesper",
          "il club",
          "il locale"
        ],
        "category": "pubblici",
        "type": "club_esclusivo",
        "role_saga": "location centrale — arena del romanzo",
        "appears_in_units": [],
        "stato_per_unita": {},
        "links": {
          "catalog_path": "catalogo/locations/the_vesper/scheda.md",
          "bibbia_section": "luoghi/the_vesper"
        },
        "promotion": {
          "promoted_at": "2026-06-05",
          "promoted_by": "bootstrap",
          "promotion_unit": null
        }
      },
      "vesper_level_minus2": {
        "id": "vesper_level_minus2",
        "name": "Level -2",
        "aliases": [
          "il sotterraneo",
          "i sotterranei",
          "la suite di recupero"
        ],
        "category": "segreti",
        "type": "area_segreta",
        "role_saga": "area segreta dove Volkov detiene le persone problematiche",
        "appears_in_units": [],
        "stato_per_unita": {},
        "links": {
          "catalog_path": "catalogo/locations/vesper_level_minus2/scheda.md",
          "bibbia_section": "luoghi/level_minus2"
        },
        "promotion": {
          "promoted_at": "2026-06-05",
          "promoted_by": "bootstrap",
          "promotion_unit": null
        }
      },
      "seattle": {
        "id": "seattle",
        "name": "Seattle",
        "aliases": [
          "la città"
        ],
        "category": "pubblici",
        "type": "città",
        "role_saga": "ambientazione del romanzo",
        "appears_in_units": [],
        "stato_per_unita": {},
        "links": {
          "catalog_path": "catalogo/locations/seattle/scheda.md",
          "bibbia_section": "luoghi/seattle"
        },
        "promotion": {
          "promoted_at": "2026-06-05",
          "promoted_by": "bootstrap",
          "promotion_unit": null
        }
      }
    },
    "groups": {
      "famiglia_volkov": {
        "id": "famiglia_volkov",
        "name": "Famiglia Volkov",
        "aliases": [
          "i Volkov"
        ],
        "category": "organizzazioni",
        "type": "famiglia_criminale",
        "role_saga": "organizzazione criminale collegata alle scomparse",
        "appears_in_units": [],
        "stato_per_unita": {},
        "links": {
          "catalog_path": "catalogo/groups/famiglia_volkov/scheda.md",
          "bibbia_section": "gruppi/volkov"
        },
        "promotion": {
          "promoted_at": "2026-06-05",
          "promoted_by": "bootstrap",
          "promotion_unit": null
        }
      }
    },
    "objects": {
      "registratore_digitale": {
        "id": "registratore_digitale",
        "name": "Registratore digitale",
        "aliases": [
          "il registratore"
        ],
        "category": "simbolici",
        "type": "strumento_professionale",
        "role_saga": "oggetto simbolo di Rory, la sua 'arma'",
        "appears_in_units": [],
        "stato_per_unita": {},
        "links": {
          "catalog_path": "catalogo/objects/registratore_digitale/scheda.md",
          "bibbia_section": "oggetti/registratore"
        },
        "promotion": {
          "promoted_at": "2026-06-05",
          "promoted_by": "bootstrap",
          "promotion_unit": null
        }
      }
    }
  },
  "units": {},
  "global_relations": {
    "narrative_promises": {},
    "explicit_callbacks": {},
    "narrative_debts": {},
    "character_arcs": {}
  },
  "quote_tracker": {},
  "misalignments_path": "misalignments.json",
  "audit": {
    "last_run": null,
    "results": {
      "audit_1_integrity": "skip",
      "audit_2_schema": "skip",
      "audit_3_navigability": "skip",
      "audit_4_drift": "skip"
    }
  }
}